Name,CPR,Email,Diagnosis,Notes
Kasper Pedersen-Clausen,894478-4879,astridlund@example.net,Diabetes,Enim quidem quae cum voluptates.
Benny Nilsson-Brandt,950290-3602,christoffersenchristine@example.com,Diabetes,Soluta reprehenderit dolor quo.
Edwin King,285560-4722,tornqvistelsa@example.net,Hypertension,Aliquam voluptas tenetur saepe nisi iusto libero eius voluptas nobis.
Verner Krantz,426291-7649,iravn@example.org,Hypertension,Sikkert par konsensus ovn berømthed skønhed hård begrænset publikum.
Johan Olesen,101556-7223,laerke87@example.com,Asthma,Thousand watch through serious agree ten though start case low institution.
Amber Williams,941934-3764,hhenriksen@example.net,Diabetes,Officiis inventore ex quam nulla fuga sequi.
Diamond Smith,476249-1601,gwahlberg@example.org,Hypertension,Politisk vindue skæbne der ejendom.
Lisa Garza,704671-5844,michael90@example.com,Hypertension,Arrive peace make social democratic hot down against civil.
Birgitta Jakobsson,290788-7688,ragnar40@example.com,Asthma,Amet architecto illo dicta nemo quos fugiat possimus ullam.
Karolina Lundberg,279643-2442,saralevin@example.com,Asthma,Perferendis dicta harum quidem eveniet voluptatum iusto.
William Henriksen,150956-1445,rachaelbrooks@example.com,Hypertension,Car join draw into morning character black.
Betty Jenkins,653628-6798,dan27@example.net,Hypertension,Et corrupti tempora dolorem dignissimos distinctio eligendi saepe.
Patty Mckenzie,176500-2764,ystrand@example.com,Hypertension,Sprog næste igennem tag udseende skygge ved sikker.
Victoria Kelly,755460-6123,kbylund@example.net,Diabetes,Placeat cupiditate ex aut fuga sequi.
Ester Kristensson,103194-7135,aostergaard@example.net,Diabetes,Samling forskellige lunge bekymre vejen klaver hed uafhængighed.
Manuel Payne,059068-0775,winniethygesen@example.org,Hypertension,A corporis adipisci voluptatem ea earum sapiente.
Michelle Thomas,329838-8094,boris96@example.net,Asthma,Cause result start receive dark friend meeting vote however nature.
Frida Schmidt-Winther,779231-8677,stigbech@example.org,Diabetes,Alder national igangværende ikke signal.
Maria Lindblom,886989-4405,irenelarsson@example.com,Asthma,Bruser måle hjælpe fisk domfældelse direkte kort opbevaring disse.
Edith Edlund,474463-2117,finn60@example.net,Hypertension,Range mind magazine describe wide.
Jesse Carney,332695-9103,ljohansson@example.com,Hypertension,Distinctio temporibus molestiae quas libero delectus libero quas.
Amanda Søndergaard,955157-6077,jeanetteeriksson@example.com,Diabetes,Bekymring formel liste vi måne jet.
Egon Granath,926811-6381,nanna00@example.org,Asthma,Eum similique vel cupiditate error exercitationem consequatur eveniet ex.
Lucas Johnsson Mårtensson,886626-3119,maiken81@example.com,Hypertension,Personale passager ville parat republikansk alle privat.
Hr Kåre Jepsen,776582-3906,august51@example.net,Hypertension,Minima placeat magnam odit cupiditate quisquam iusto voluptates.
Samantha Morales,342193-6809,okarlsson@example.net,Asthma,Formand musiker erkende dokument vagt følelse side måne vild trussel let.
Ingrid Mårtensson,602065-3974,malexander@example.com,Asthma,Baseball trussel metode minde fodbold erkende publikum kritisk dimension.
Elisabeth Ljung,777344-8238,kenneth55@example.net,Diabetes,Nulla nisi maxime qui mollitia hic earum quia.
Hannah Jones,664401-2715,klarsen@example.com,Diabetes,Inventore minus neque quae.
Petra Isaksson,257684-1607,ceciliahedberg@example.net,Hypertension,Dolor minima nam adipisci voluptate similique nihil nisi quas.
Jeanette Stenlund,342738-3554,wahlbergarvid@example.com,Hypertension,Industri korrekt af alternativ erkende verden avis.
Justin Jones,316242-6218,kimhansen@example.org,Asthma,Personal outside realize they shoulder strategy.
Donna Wilson,600050-7010,lindgyda@example.net,Hypertension,Know professor that past enough weight by official.
Melker Nordin-Karlsson,862620-2840,svenningravn@example.net,Diabetes,Lugt forvirring mund gevinst endelig.
Werner Bech-Hansen,109314-2026,henryjacobsen@example.net,Hypertension,Store magazine represent account child resource PM dream remain.
Craig Torres,940134-4040,linneajohansson@example.com,Asthma,Totam quae qui hic incidunt.
Amanda Baldwin,697887-4858,ravnsusanne@example.org,Diabetes,Unde debitis dolor explicabo reiciendis repudiandae.
Ditte Bruun,897367-7419,chandlershannon@example.org,Hypertension,Quisquam nemo nesciunt nostrum.
Helena Sandström,957480-4951,gcain@example.net,Asthma,Quaerat quasi inventore sunt dolor quae nesciunt ad consectetur blanditiis.
Prof. Maria Hermansen,879663-0050,bertelsencecilie@example.org,Hypertension,Begrænset afslut vågne tegning kongres.
Univ.Prof. Ruben Clausen,654600-9502,jonathanmoller@example.net,Asthma,Fugiat reiciendis doloribus fugit laborum quo animi similique nihil doloremque.
Jeppe Søndergaard,025843-1927,davidsonanne@example.com,Hypertension,Lethed kul forfatter indsats gård vågne.
Jan Lundin,404084-8027,porterjennifer@example.com,Diabetes,Dolorum aliquam distinctio explicabo veniam dolores sit.
Kerstin Hellström,055158-8051,patrickramirez@example.net,Hypertension,Kontrast se klaver te lyd over sælge tå knap lastbil.
Jennifer Rodriguez,542550-4377,erna78@example.org,Hypertension,Tough avoid bank production that board individual shake if room.
Maria Andersson-Karlsson,820165-2896,svenssonalexander@example.net,Diabetes,Professional seek still account bad admit third.
Veronika Strandberg Andersson,389995-1224,jean75@example.org,Diabetes,Skade gammel ned evne dette.
Sören Lundqvist,871204-0794,margitthorsen@example.net,Hypertension,Konkurrence eksempel erkende rådgiver live.
Dr. Herbert Andresen,363019-1755,rolflind@example.org,Asthma,Culpa quas nobis voluptates numquam voluptatum at quae.
Dan Andresen,460071-5632,james78@example.org,Asthma,Alligevel finansiel forurening øjeblik ting løbet fremstille vælg titel din kunne.
Albert Mortensen,284093-6418,nathan81@example.com,Hypertension,Free piece billion others go always Republican tree while.
Ellen Thor,429006-4915,birgittaahmed@example.com,Asthma,Frokost hit behandling især forberedelse morgen skov komme følge.
Herman Jespersen,363881-7327,aagefrederiksen@example.net,Asthma,Deal sometimes idea race apply start positive.
Joakim Lind,012318-6112,ulindquist@example.com,Diabetes,Itaque vel sint sapiente corporis rem animi.
Dawn Morris,297282-4358,bnyman@example.com,Diabetes,Molestias illum laboriosam quibusdam perspiciatis possimus aliquam quae tenetur.
Marcus Bäckström,113969-7238,higginsjason@example.org,Hypertension,Daughter article citizen yourself red company management long guy.
Fru Merete Andreasen,004035-2216,elliotblomgren@example.net,Diabetes,Koncentration live nå hør vital men album.
Leslie Ball,187066-9595,johnsonnicholas@example.net,Asthma,Fænomen karakter insistere til trick disse arbejder vej forklare observation.
Susanna Boman,926457-0732,lmalmberg@example.net,Hypertension,Facilis tempora perferendis id unde nisi.
Karin Johansson-Magnusson,138962-4421,dhunter@example.org,Asthma,Ipsum eaque laudantium iure autem.
Prof. Irma Koch,119391-5722,jespersenmargit@example.org,Hypertension,Election also agreement probably ok friend establish exactly company.
Univ.Prof. Mette Pedersen,842569-3146,slindholm@example.com,Asthma,Customer visit fund room team subject environment.
Kimberly Johnson,713026-3525,linnea18@example.org,Asthma,Hope conference song page statement late land.
Johan Pettersson,904519-7868,sundqvistsvea@example.com,Asthma,Animi minus totam veritatis esse reiciendis voluptate quaerat perspiciatis atque.
Hans Berg-Rosén,793056-2072,teriksen@example.net,Asthma,Jet musikalsk uanset forklare projekt vælge afgrøde stemme emne funktion.
Tina Wu,957049-1747,stephanie57@example.net,Asthma,Shoulder bad mother agreement place.
Dennis Josefsson,079953-4854,stewartemily@example.org,Hypertension,Itaque maxime enim sint at maiores tempora velit porro.
Mads Eriksen-Laursen,319382-4965,danielle55@example.net,Diabetes,Tank sent artikel også vejen luft øjeblikket løg røg midt.
Christoffer Nilsson Persson,710199-7136,hanne86@example.com,Diabetes,Boy dog section including popular drive many.
David Karlsson,665440-3633,jason05@example.com,Asthma,Karakter syre nord nummer flaske.
Karoline Carlsen-Pedersen,703328-2463,marcus37@example.org,Diabetes,Klaver kvalitet etage sukker snart gul løg støj.
Silas Gregersen-Lauridsen,001234-2876,jean63@example.net,Hypertension,Facilis fuga neque minus expedita temporibus repudiandae quia ad quia.
Sussanne Bruun,942575-1402,nkristoffersen@example.org,Asthma,International ground believe sound interesting measure by radio least person.
Cirkeline Kjeldsen,760189-5041,elisajonsson@example.com,Asthma,Expert have eat whether laugh space language full bed level.
Prof. Tom Christiansen,585141-6583,martin32@example.net,Hypertension,Indeed save particular ahead war produce though test another.
Mikael Johansson,080043-4935,christopher22@example.com,Asthma,Error ipsum ratione voluptates itaque.
Pia Svensson,632319-6276,jensenclara@example.org,Asthma,President action market close picture material could themselves huge plan.
Esben Johansen,558690-9409,ipersson@example.com,Hypertension,Esse minus voluptate quibusdam quas sequi.
William Svendsen,917891-8359,davisebony@example.com,Asthma,Minus quo aliquid modi alias necessitatibus in odio reiciendis.
Univ.Prof. Joachim Kjeldsen,684781-0595,ashleyoconnor@example.net,Hypertension,Sky national konflikt kat vælge snart design resterende tag.
Joshua Williams,650933-5095,ulf27@example.com,Diabetes,Dræbe fordel formue data immigrant stolt dokument fodbold ud fru.
Mohammed Johansson-Pettersson,215295-5767,kristiansengeorg@example.com,Hypertension,Population hear similar choose wife.
Prof. Patrick Johnsen,118341-5245,benjaminjakobsen@example.net,Asthma,Ekspert glemme detaljeret arbejde mål.
Fru Ingelise Nissen,273753-2100,karlfriberg@example.com,Diabetes,Gentage under ja bebrejde omsorg.
Univ.Prof. Ole Friis,081899-8859,gregersenkarlo@example.com,Asthma,Erhverve peber fylde adresse hus.
James Wright,735388-6826,sundbergmartina@example.com,Asthma,Provins nylig reaktion tegne moderne give.
Prof. Andrea Mathiesen,946035-6494,charlesleon@example.com,Diabetes,Spring tonight industry set everybody short eight.
Zachary Williams,907757-2170,hansenmikael@example.net,Diabetes,Find quality Democrat very or left wait rather.
Willie Jones,101677-3882,leiadanielsson@example.org,Hypertension,Meet special experience my myself front attention.
Matthew Poole,490184-7066,qdanielsen@example.com,Hypertension,Occur low among box show.
John Walker,927982-6738,johannasvard@example.org,Diabetes,Reprehenderit impedit tempora facere repudiandae asperiores eum fugiat nemo dicta.
Nicole Thompson,800433-2656,overgaardgrete@example.com,Asthma,Dignissimos accusantium itaque cum natus nostrum neque nulla.
Gunhild Mikkelsen,932815-2927,kyle49@example.net,Diabetes,Quaerat facere fuga quos placeat aut architecto voluptate.
Jonna Mikkelsen,976585-8393,gregersentove@example.com,Hypertension,Be heavy center watch international sit.
Dr. Kenn Kristoffersen,611656-5371,pfriis@example.org,Diabetes,Staff buy could call mother general professor property range rest.
Danielle Hill,945203-0369,camillamortensen@example.net,Asthma,Tempore rem pariatur tenetur reprehenderit sunt ea maxime hic.
Ryan Bullock,069575-7214,lundgrenbengt@example.org,Diabetes,Public close discover American choice eat.
Sussanne Lauritsen,881059-8421,nathan56@example.org,Asthma,Agree like fine he left budget part after.
Emil Eliasson,434122-0854,ernst08@example.net,Asthma,Nostrum id animi consequatur nesciunt blanditiis labore.
Hans Karlsson,185304-7180,sanna06@example.net,Asthma,Rerum est maiores impedit numquam excepturi eius ipsam.
